Topic,Words,Frequency,Timestamp
121,"promo, potsdam, möchte, potsdamer, wahlkreis",1,2024-05-26 13:30:00
122,"maut, lkw, wasserstoff, bundesverband, fordern",1,2024-05-26 13:30:00
123,"starliner, kapsel, nasa, raumschiff, icq",3,2024-05-26 13:30:00
128,"festival, musik, august, kerb, traditionelle",3,2024-05-26 13:30:00
131,"anträge, pass, zahl, einbürgerungen, wiedergutmachungseinbürgerung",2,2024-05-26 13:30:00
133,"tiffany, frauen, trapp, weißgold, messika",2,2024-05-26 13:30:00
135,"uvalde, activision, duty, meta, call",1,2024-05-26 13:30:00
-1,"der, die, und, in, von",161,2024-05-27 12:00:00
0,"ukraine, russland, russischen, waffen, selenskyj",18,2024-05-27 12:00:00
1,"rafah, israel, hamas, israelischen, israels",23,2024-05-27 12:00:00
2,"trump, geschworenen, donald, trumps, cohen",10,2024-05-27 12:00:00
3,"torhüter, em, bundestrainer, torhütern, nagelsmann",7,2024-05-27 12:00:00
4,"uni, trump, protestcamps, hochschulen, universität",5,2024-05-27 12:00:00
5,"tesla, vw, porsche, volkswagen, 911",17,2024-05-27 12:00:00
6,"ich, unternehmen, fes, 50er, mehr",6,2024-05-27 12:00:00
7,"polizei, krankenhaus, böhme, schöneberg, jähriger",2,2024-05-27 12:00:00
8,"tiere, projektgruppe, hunde, seeadler, rudow",5,2024-05-27 12:00:00
9,"merz, eu, europa, abela, prozent",6,2024-05-27 12:00:00
10,"fotografie, kobell, kemp, 1839, museum",13,2024-05-27 12:00:00
11,"kerber, rus, zverev, turnier, french",5,2024-05-27 12:00:00
12,"bahn, fahrgäste, karstadt, zug, zwischen",3,2024-05-27 12:00:00
13,"iran, raisi, uran, ghalibaf, iaea",3,2024-05-27 12:00:00
14,"gracie, smith, sie, nathansky, nadine",6,2024-05-27 12:00:00
15,"miete, wohnungen, vdp, kauf, wohnen",8,2024-05-27 12:00:00
16,"polizeiruf, requisiteur, kripo, filmset, leiche",1,2024-05-27 12:00:00
17,"fpö, afd, krah, kickl, vilimsky",2,2024-05-27 12:00:00
18,"rwe, kfw, windparks, offshore, eigentümer",9,2024-05-27 12:00:00
19,"volkspark, beachvolleyball, potsdam, felder, synagoge",4,2024-05-27 12:00:00
20,"apple, ipad, app, mac, iphone",7,2024-05-27 12:00:00
21,"taiwan, china, lai, dpp, parlament",6,2024-05-27 12:00:00
22,"auto, polizei, stromschlag, güterzug, autofahrer",4,2024-05-27 12:00:00
23,"kompany, vincent, verpflichtung, bayern, rummenigge",2,2024-05-27 12:00:00
24,"macron, französischen, europa, deutsch, emmanuel",13,2024-05-27 12:00:00
25,"sonnenallee, augsburg, rohr, montagabend, gewitter",2,2024-05-27 12:00:00
26,"rassistische, parolen, sylt, video, gesungen",8,2024-05-27 12:00:00
27,"horterzieherinnen, höhergruppierung, besitzstandsregelung, gehaltszulage, gesamtpersonalrat",1,2024-05-27 12:00:00
28,"kubernetes, managed, nutanix, cloud, vmware",5,2024-05-27 12:00:00
30,"bsw, quasebarth, wagenknecht, sahra, wolf",5,2024-05-27 12:00:00
31,"lichtverschmutzung, thb, ökosysteme, erdoberfläche, co₂",2,2024-05-27 12:00:00
32,"papua, neuguinea, erdrutsch, begraben, erde",4,2024-05-27 12:00:00
33,"rente, lindner, steuervergünstigungen, steuern, mehreinnahmen",4,2024-05-27 12:00:00
34,"dillmann, komparsen, filmmuseum, eick, gesucht",3,2024-05-27 12:00:00
35,"ki, openai, publica, update, re",1,2024-05-27 12:00:00
36,"fisch, spandau, altstadt, marktplatz, pelz",1,2024-05-27 12:00:00
37,"brand, honold, feuerwehr, brandnacht, zerstörung",2,2024-05-27 12:00:00
38,"gwm, europa, china, autos, fahrzeuge",2,2024-05-27 12:00:00
39,"hautkrebs, lungenkrebs, hautkrebsbehandlungen, diagnosen, barmer",2,2024-05-27 12:00:00
41,"reuß, prinz, dachdecker, vitalia, osnabrück",4,2024-05-27 12:00:00
42,"milei, javier, karina, schwester, argentiniens",1,2024-05-27 12:00:00
43,"bobic, hertha, kündigung, hellmann, staatsanwaltschaft",6,2024-05-27 12:00:00
44,"labour, wirtschaftsvertreter, regierungswechsel, britischen, partei",1,2024-05-27 12:00:00
45,"ki, antworten, chatbots, it, llm",2,2024-05-27 12:00:00
46,"pflegeversicherung, lauterbach, atlas, pflege, 2025",5,2024-05-27 12:00:00
47,"thüringen, 6300, bleicherode, henning, bsw",2,2024-05-27 12:00:00
48,"palästina, staat, anerkennung, norwegen, irland",7,2024-05-27 12:00:00
49,"ramaphosa, anc, partei, zuma, südafrikas",1,2024-05-27 12:00:00
51,"iwf, ifo, unternehmen, industrie, wirtschaft",9,2024-05-27 12:00:00
52,"christie, cert, auktionshaus, kpmg, ransomhub",5,2024-05-27 12:00:00
53,"tyson, mike, bord, flug, airlines",1,2024-05-27 12:00:00
54,"grübeln, gedanken, einsamkeit, funk, zwangsgedanken",1,2024-05-27 12:00:00
55,"real, halbfinal, league, madrid, champions",1,2024-05-27 12:00:00
56,"ubuntu, risc, visionfive, milk, mars",1,2024-05-27 12:00:00
57,"scholz, hamburg, olaf, schietwetter, quoten",2,2024-05-27 12:00:00
58,"hartmann, heine, wiesbaden, oper, intendantinnen",3,2024-05-27 12:00:00
59,"limonade, zucker, lemonaid, lufthansa, kaffee",4,2024-05-27 12:00:00
60,"dsa, eu, kommission, agarwal, plattformen",5,2024-05-27 12:00:00
61,"eilish, taylor, billie, swift, konzerte",1,2024-05-27 12:00:00
62,"isi, fraunhofer, fahrrad, motocross, studie",2,2024-05-27 12:00:00
64,"the, ruanda, to, kagame, kigali",1,2024-05-27 12:00:00
65,"christen, selzer, meier, kirche, schaus",2,2024-05-27 12:00:00
66,"mobile, verivox, cellular, roaming, netz",4,2024-05-27 12:00:00
68,"ezb, zinsen, zinswende, prozent, inflation",4,2024-05-27 12:00:00
69,"gesetz, eu, georgiens, georgien, parlament",5,2024-05-27 12:00:00
70,"materials, ig, metall, services, lopez",1,2024-05-27 12:00:00
74,"einzuspannen, memes, popmusik, agostinos, propaganda",1,2024-05-27 12:00:00
76,"spiralarmen, lichtjahren, sternentstehungsregionen, spiralgalaxie, staubbahnen",1,2024-05-27 12:00:00
78,"südkorea, nordkorea, japan, pjöngjang, seoul",4,2024-05-27 12:00:00
79,"sunrise, börsengang, rollstuhlhersteller, aktien, rechenzentren",2,2024-05-27 12:00:00
80,"wolken, gewittriger, gebietsweise, starkregen, trocken",2,2024-05-27 12:00:00
81,"platzpatronen, mannschaften, bamboleo, polizei, vereine",4,2024-05-27 12:00:00
82,"mallorca, palma, martínez, terrasse, einsturz",4,2024-05-27 12:00:00
83,"bangladesch, grad, indien, tornado, tornados",3,2024-05-27 12:00:00
84,"celtics, finals, brown, nba, eastern",1,2024-05-27 12:00:00
85,"flüchtlinge, seibert, tegel, plätze, unterkunft",4,2024-05-27 12:00:00
86,"jameda, ärzten, elsässer, arzt, ki",1,2024-05-27 12:00:00
89,"view, internet, google, bay, zeltartigen",1,2024-05-27 12:00:00
91,"fraport, schulte, terminal, millionen, standortkosten",1,2024-05-27 12:00:00
92,"pnn, kreuzungen, kommunalwahl, potsdam, stadtteilen",2,2024-05-27 12:00:00
94,"fridays, future, for, fff, potsdam",1,2024-05-27 12:00:00
95,"grünen, terry, reintke, spitzenkandidatin, begabte",3,2024-05-27 12:00:00
96,"mail, de, nutzer, mobilfunknetz, roaming",2,2024-05-27 12:00:00
97,"mai, bundespolizei, münch, straftaten, vom",1,2024-05-27 12:00:00
99,"galeria, gläubiger, kaufhof, denkhaus, karstadt",10,2024-05-27 12:00:00
100,"musk, xai, ki, elon, supercomputer",2,2024-05-27 12:00:00
101,"walton, campbell, nba, reiterin, bill",3,2024-05-27 12:00:00
102,"meloni, leyen, pen, le, ursula",2,2024-05-27 12:00:00
103,"earthcare, esa, start, exploration, mission",2,2024-05-27 12:00:00
104,"dax, bestmarke, 18, handel, leitindex",1,2024-05-27 12:00:00
109,"kronensetzen, zähneziehen, jobeinstieg, fälschen, abrechnungen",1,2024-05-27 12:00:00
112,"roboter, blindenhund, zauberwürfel, blindenhunde, rubik",2,2024-05-27 12:00:00
115,"metzeler, kick, hungerstreik, scholz, wolli",1,2024-05-27 12:00:00
119,"alba, chemnitz, thiemann, chemnitzer, halbfinale",1,2024-05-27 12:00:00
121,"promo, potsdam, wahlkreis, potsdamer, ortsteile",1,2024-05-27 12:00:00
122,"wasserstoff, ipcei, kommission, genehmigt, eu",2,2024-05-27 12:00:00
123,"mond, gerst, tagesschau, missionen, wir",1,2024-05-27 12:00:00
124,"papst, franziskus, entschuldigt, homosexuelle, schwuchtelei",5,2024-05-27 12:00:00
125,"vulkanausbrüche, vulkan, vulkanische, venus, ausgebrochen",2,2024-05-27 12:00:00
126,"podcast, uns, 0172, 7782384, relevantesten",1,2024-05-27 12:00:00
128,"karneval, kulturen, umzugsteilnehmer, konsumvolksfest, saufgelagen",1,2024-05-27 12:00:00
129,"everest, purnima, shrestha, sherpa, mount",3,2024-05-27 12:00:00
131,"einbürgerungen, eingebürgerten, zahl, stieg, prozent",5,2024-05-27 12:00:00
133,"kimono, jeans, prunkstücken, stiefeln, sublimen",2,2024-05-27 12:00:00
134,"bankenaufsicht, bundesbank, ki, banken, drescher",1,2024-05-27 12:00:00
-1,"die, der, und, in, von",146,2024-05-28 10:30:00
0,"ukraine, russland, waffen, iwanischwili, russischen",21,2024-05-28 10:30:00
1,"rafah, hamas, israel, israels, israelischen",18,2024-05-28 10:30:00
2,"trump, trumps, geschworenen, donald, cohen",9,2024-05-28 10:30:00
3,"amedegnato, volleys, ich, em, hummels",3,2024-05-28 10:30:00
4,"symbol, dreieck, universität, rote, hamas",4,2024-05-28 10:30:00
5,"vw, blume, opel, volkswagen, elektroautos",10,2024-05-28 10:30:00
6,"henkel, elternzeit, prozent, beschäftigten, arbeitgeber",12,2024-05-28 10:30:00
7,"mann, jährigen, spandau, polizei, soll",4,2024-05-28 10:30:00
8,"hyalomma, zecken, zecke, triester, marginatum",9,2024-05-28 10:30:00
9,"eu, europawahl, europäischen, europa, venezuela",9,2024-05-28 10:30:00
10,"kinder, ausstellung, larass, gemälde, schau",4,2024-05-28 10:30:00
11,"zverev, altmaier, djokovic, padel, tsitsipas",3,2024-05-28 10:30:00
12,"bahn, ersatzverkehr, lokführer, s21, fahrgäste",6,2024-05-28 10:30:00
14,"gracie, haynes, december, bridgerton, may",5,2024-05-28 10:30:00
15,"sozialleistungen, prozent, marzahn, hellersdorf, euro",6,2024-05-28 10:30:00
16,"mittellandkanal, volkswagen, stammwerks, polizeiboote, autostadt",1,2024-05-28 10:30:00
17,"afd, krah, flick, fraktion, leute",1,2024-05-28 10:30:00
18,"erdgas, gas, kosten, gasheizungen, gasnetze",3,2024-05-28 10:30:00
19,"hahn, bigfoot, haltung, hahns, marx",4,2024-05-28 10:30:00
20,"apple, apples, nm, iphone, preisvergleich",5,2024-05-28 10:30:00
21,"taiwan, lai, china, huarong, bai",3,2024-05-28 10:30:00
22,"unfall, polizei, auto, raser, fahrer",5,2024-05-28 10:30:00
23,"kompany, bayern, trainer, fc, vincent",7,2024-05-28 10:30:00
24,"macron, scholz, frankreich, emmanuel, europa",4,2024-05-28 10:30:00
25,"sonnenallee, wasserbetriebe, straße, braunschweiger, inhalt",1,2024-05-28 10:30:00
26,"parolen, rassistische, sylt, video, toujours",4,2024-05-28 10:30:00
27,"praktika, praktikumswoche, spieker, auszubildenden, ihk",1,2024-05-28 10:30:00
28,"foxit, workshop, it, tennet, reader",6,2024-05-28 10:30:00
30,"wagenknecht, rasmus, sahra, spiegel, bsw",4,2024-05-28 10:30:00
31,"co₂, speicherung, ccs, carbon, kohlendioxid",5,2024-05-28 10:30:00
33,"rentenpaket, rente, ii, lindner, heil",14,2024-05-28 10:30:00
34,"erhard, anna, musikerin, song, humorvoller",1,2024-05-28 10:30:00
35,"ki, openai, paste, advanced, rabbit",2,2024-05-28 10:30:00
36,"henrich, henrichs, restaurant, brunos, weihenstephaner",1,2024-05-28 10:30:00
38,"china, zölle, chinesische, autos, chinesischen",6,2024-05-28 10:30:00
39,"bakterium, vogelgrippe, brasilien, krebs, dengue",5,2024-05-28 10:30:00
40,"wetterdienst, dwd, hochwasser, quadratmeter, überflutungen",2,2024-05-28 10:30:00
41,"bushido, abou, chaker, arafat, bruder",1,2024-05-28 10:30:00
43,"büroleiterin, benko, pirolt, privatstiftung, weils",2,2024-05-28 10:30:00
44,"davey, labour, democrats, gummihammer, tories",1,2024-05-28 10:30:00
45,"ki, zimpel, intelligenz, pflege, neurodivergente",6,2024-05-28 10:30:00
46,"mrt, lauterbach, zahnmedizin, strahlenfreie, schonender",2,2024-05-28 10:30:00
47,"afd, prozent, cdu, thüringen, kreistags",1,2024-05-28 10:30:00
48,"anerkennung, staat, palästina, palästinas, palästinenser",1,2024-05-28 10:30:00
49,"anc, südafrika, ramaphosa, mehrheit, absolute",7,2024-05-28 10:30:00
50,"venedig, leon, fti, donna, eintrittsgebühr",3,2024-05-28 10:30:00
51,"iwf, wirtschaft, schuldenbremse, fletcher, globalisierung",5,2024-05-28 10:30:00
52,"live, nation, shinyhunters, christie, datenleck",2,2024-05-28 10:30:00
53,"flugzeug, klm, passagiere, flughafen, mensch",4,2024-05-28 10:30:00
54,"einsamkeit, einsam, diabaté, pandemie, menschen",1,2024-05-28 10:30:00
56,"cortex, dram, arm, 3d, x925",2,2024-05-28 10:30:00
57,"cum, hsh, ex, nordbank, scholz",7,2024-05-28 10:30:00
58,"musikerinnen, roth, goecke, einzelunterricht, peitz",2,2024-05-28 10:30:00
59,"ballern, lachgas, baller, ballons, lungenbläschen",1,2024-05-28 10:30:00
60,"republica, digitalpakt, horizons, digitalen, arora",3,2024-05-28 10:30:00
62,"verkehrsberuhigung, tauentzien, unfall, ku, tauentzienstraße",1,2024-05-28 10:30:00
64,"palermo, leoluca, orlando, mafia, flüchtlingen",1,2024-05-28 10:30:00
65,"katholikentag, kirche, erfurt, stetter, kirchen",3,2024-05-28 10:30:00
66,"telekom, geräte, vodafone, datenvolumen, android",3,2024-05-28 10:30:00
68,"prozent, dax, traton, dollar, inflation",1,2024-05-28 10:30:00
69,"pis, polen, eu, kommission, verfahren",4,2024-05-28 10:30:00
70,"werft, meyer, köfler, 440, geschäftsführung",4,2024-05-28 10:30:00
71,"martin, lang, autor, drehbuchautoren, hochzeit",2,2024-05-28 10:30:00
73,"křetínský, ids, royal, ep, mail",6,2024-05-28 10:30:00
74,"kieler, toujours, amour, dornberger, partysong",2,2024-05-28 10:30:00
76,"osiris, eridani, sonne, apex, trek",3,2024-05-28 10:30:00
77,"snus, cannabis, zigaretten, schmerzmittel, konsumiert",4,2024-05-28 10:30:00
78,"südkorea, nordkorea, ballons, grenze, flugblättern",5,2024-05-28 10:30:00
79,"etfs, aktien, anlagestrategie, beträgen, finanzkrise",3,2024-05-28 10:30:00
80,"fließ, tegeler, rinder, reinickendorf, rasenmäher",1,2024-05-28 10:30:00
81,"fanhilfen, saisonbericht, dachverband, polizeieinsätze, eskalationsspirale",1,2024-05-28 10:30:00
83,"grad, delhi, temperaturen, indien, niño",1,2024-05-28 10:30:00
86,"medizin, goethe, doctolib, methoden, forschung",3,2024-05-28 10:30:00
89,"google, seo, leak, gewichtung, branche",1,2024-05-28 10:30:00
90,"tu, rauch, präsidentin, geraldine, antisemitismus",3,2024-05-28 10:30:00
91,"ber, flughafen, pannenflughafen, flughäfen, portal",2,2024-05-28 10:30:00
92,"pnn, wünschen, rechtsdruck, stadtteilen, wählerwille",1,2024-05-28 10:30:00
94,"fridays, future, for, europawahl, klimaschutz",1,2024-05-28 10:30:00
95,"grünen, vorfeldorganisationen, wirtschaftsvereinigung, fusionieren, mitglieder",1,2024-05-28 10:30:00
96,"störung, behoben, netzes, probleme, beseitigen",2,2024-05-28 10:30:00
97,"verheerende, leserinnen, leser, kriminalität, chaos",1,2024-05-28 10:30:00
99,"hülsta, mws, stadtlohn, galeria, insolvenzverwalter",2,2024-05-28 10:30:00
100,"musk, elon, whatsapp, nutzerdaten, tesla",3,2024-05-28 10:30:00
103,"esa, earthcare, wolken, mission, rakete",5,2024-05-28 10:30:00
107,"habeck, strafzölle, china, welthandel, dumping",1,2024-05-28 10:30:00
111,"prozent, ezb, inflation, inflationsrate, mai",7,2024-05-28 10:30:00
112,"roboter, tepco, fukushima, daiichi, testentnahme",1,2024-05-28 10:30:00
113,"rheinmetall, rüstungskonzern, borussia, dortmund, bvb",8,2024-05-28 10:30:00
115,"metzeler, klimaaktivist, kick, wolfgang, hungernder",1,2024-05-28 10:30:00
117,"ftx, salame, bankman, fried, haft",2,2024-05-28 10:30:00
121,"promo, potsdam, wahlkreis, bezahlbar, trete",1,2024-05-28 10:30:00
122,"wasserstoff, elektrolyseure, energien, wasserstoffprojekte, wasserstoffbeschleunigungsgesetz",2,2024-05-28 10:30:00
125,"grindavík, lava, vulkanausbruch, vulkan, ausbruch",3,2024-05-28 10:30:00
126,"podcast, uns, mitgeplant, 0172, 7782384",1,2024-05-28 10:30:00
132,"fico, heilungsprozess, slowakischen, attentat, robert",1,2024-05-28 10:30:00
134,"ki, investitionen, rechnungshof, eu, rechnungshofs",1,2024-05-28 10:30:00
-1,"der, und, die, in, das",122,2024-05-29 09:00:00
0,"ukraine, russland, waffen, nato, pistorius",24,2024-05-29 09:00:00
1,"israel, hamas, rafah, ägypten, israels",20,2024-05-29 09:00:00
2,"trump, trumps, donald, geschworenen, richter",12,2024-05-29 09:00:00
3,"em, wüst, gründerpreis, dfb, wucherer",7,2024-05-29 09:00:00
4,"polizei, lelle, sonnenallee, demonstration, nikolas",8,2024-05-29 09:00:00
5,"kilo, suv, autos, modellreihen, kba",8,2024-05-29 09:00:00
6,"job, prozent, befragten, studierenden, spandau",2,2024-05-29 09:00:00
7,"polizei, frau, schweiz, festgenommen, mann",3,2024-05-29 09:00:00
8,"tiere, straßenhunde, schrödl, arion, vulgaris",3,2024-05-29 09:00:00
9,"prozent, eu, neukölln, europawahl, union",5,2024-05-29 09:00:00
10,"kielstein, schulenburg, van, velde, nostra",3,2024-05-29 09:00:00
11,"zverev, french, open, goffin, nadal",6,2024-05-29 09:00:00
12,"bvg, bahn, u8, taxis, obdachlose",4,2024-05-29 09:00:00
13,"wächterrat, bewerber, raisi, präsidenten, iranischen",1,2024-05-29 09:00:00
14,"schwert, mortensen, ringwald, hollywood, kidman",3,2024-05-29 09:00:00
15,"wohnungen, mieten, immobilien, mietspiegel, hilgenfeld",7,2024-05-29 09:00:00
16,"polizisten, räumung, landeskriminalamt, humboldt, universität",1,2024-05-29 09:00:00
17,"krah, afd, krahs, auftrittsverbot, ss",3,2024-05-29 09:00:00
18,"erdgas, gasnetz, strom, eeg, förderung",2,2024-05-29 09:00:00
19,"erlebnisräume, filiale, einkaufsstraßen, potsdamer, rossmann",5,2024-05-29 09:00:00
20,"apple, mac, mx, keys, iphone",5,2024-05-29 09:00:00
21,"peking, hongkong, china, xi, taiwan",8,2024-05-29 09:00:00
22,"unfall, fahrer, auto, polizei, lkw",6,2024-05-29 09:00:00
23,"kompany, bayern, trainer, eberl, fc",7,2024-05-29 09:00:00
24,"münster, französischen, freundschaftsgesten, napoleons, tagespolitischen",1,2024-05-29 09:00:00
25,"sachsen, dauerregen, quadratmeter, niederschlägen, freitagmittag",1,2024-05-29 09:00:00
26,"lindenberg, fehmarn, sylt, parolen, amour",2,2024-05-29 09:00:00
27,"schulen, fremdsprache, schüler, türkisch, schulversuch",4,2024-05-29 09:00:00
28,"checkmk, gateways, dateien, admins, directory",3,2024-05-29 09:00:00
30,"bsw, sendung, johnsen, wahlarena, wagenknecht",2,2024-05-29 09:00:00
31,"rahmstorf, luftreinhaltung, potsdamer, klima, klimaforscher",2,2024-05-29 09:00:00
32,"erdrutsch, papua, neuguinea, panama, überlebende",4,2024-05-29 09:00:00
33,"fdp, rentenpaket, rente, ii, finanzierbarkeit",3,2024-05-29 09:00:00
34,"bach, kohlrausch, babelsberg, sibelius, homburg",5,2024-05-29 09:00:00
35,"ki, microsoft, update, windows, vorschau",2,2024-05-29 09:00:00
36,"tamtam, amon, küchenhandwerk, carbonara, süditalienisches",1,2024-05-29 09:00:00
37,"akkus, brände, ionen, lithium, scootern",1,2024-05-29 09:00:00
39,"krebs, schädel, ägypter, 4000, schnittspuren",1,2024-05-29 09:00:00
40,"dwd, gewitter, grad, starkregen, wetterdienst",4,2024-05-29 09:00:00
41,"höcke, angeklagte, gera, merseburg, reuß",2,2024-05-29 09:00:00
42,"mexiko, cabrera, wahlkampftag, bürgermeisterkandidat, attentaten",1,2024-05-29 09:00:00
44,"labour, sunak, logan, konservativen, abgeordneter",3,2024-05-29 09:00:00
46,"gkv, krankenversicherung, storm, storms, alterung",2,2024-05-29 09:00:00
47,"jannaschk, prozent, afd, cdu, kommunen",2,2024-05-29 09:00:00
48,"anerkennung, irland, norwegen, spanien, palästinenserstaates",2,2024-05-29 09:00:00
49,"anc, südafrika, wahllokalen, wahlkommission, ergebnisse",1,2024-05-29 09:00:00
50,"fti, palma, massentourismus, bürgermeister, mallorca",2,2024-05-29 09:00:00
51,"milliarden, wiederaufbaufonds, hinterher, rekordwarm, weinbau",2,2024-05-29 09:00:00
52,"schadsoftware, bka, schlag, s5, 911",10,2024-05-29 09:00:00
53,"airlines, passagiere, flugzeug, american, flug",6,2024-05-29 09:00:00
54,"einsamkeit, paus, pandemie, einsam, einsamkeitsbarometer",10,2024-05-29 09:00:00
55,"champions, league, begierde, lissen, klubfußballs",1,2024-05-29 09:00:00
56,"framework, display, ultra, core, meteor",1,2024-05-29 09:00:00
57,"rki, protokolle, geschwärzt, schwärzungen, scholz",5,2024-05-29 09:00:00
58,"heise, filmemacher, thomas, adorf, akademie",3,2024-05-29 09:00:00
61,"songtexte, reliquien, lennons, gitarren, rockstar",1,2024-05-29 09:00:00
62,"unfall, raser, tauentzienstraße, bedarf, verkehrsexperten",1,2024-05-29 09:00:00
65,"kirche, fronleichnam, katholikentag, katholiken, erfurt",7,2024-05-29 09:00:00
67,"lindner, finanzminister, kabinettsmitglieder, sparvorgaben, vorsprechen",3,2024-05-29 09:00:00
68,"salesforce, ezb, crm, anleihekäufen, geschäftsquartal",2,2024-05-29 09:00:00
69,"georgien, ausländische, gesetz, denunzieren, tritt",1,2024-05-29 09:00:00
70,"palantir, thyssenkrupp, werft, ig, karp",4,2024-05-29 09:00:00
74,"spotify, menschenverachtenden, streaming, bruckners, liedguts",1,2024-05-29 09:00:00
75,"undav, brighton, bloom, deniz, ich",1,2024-05-29 09:00:00
76,"galaxie, urknall, jades, galaxien, weltraumteleskop",1,2024-05-29 09:00:00
77,"nikotinbeutel, zigaretten, tabakfreie, suchtpotenzial, nikotin",1,2024-05-29 09:00:00
78,"nordkorea, südkorea, ballistische, raketen, japan",3,2024-05-29 09:00:00
80,"volkshochschulen, integrationskurse, berliner, jahreszeit, kalten",2,2024-05-29 09:00:00
81,"em, nahost, zugespitzt, europameisterschaft, polizei",2,2024-05-29 09:00:00
83,"delhi, grad, hitze, indien, tornados",1,2024-05-29 09:00:00
85,"bezahlkarte, flüchtlinge, alleingang, schubert, stadtverordneten",1,2024-05-29 09:00:00
89,"google, gewichtung, seo, leak, internetseiten",1,2024-05-29 09:00:00
90,"tu, rauch, präsidentin, geraldine, tweets",3,2024-05-29 09:00:00
91,"ila, luftfahrt, saf, hettrich, arnulf",1,2024-05-29 09:00:00
92,"pnn, stadt, potsdam, stadtverordnetenversammlung, eur",2,2024-05-29 09:00:00
93,"spyware, citizen, lab, pegasus, exil",2,2024-05-29 09:00:00
94,"neubauer, luisa, stimmenfang, fridays, future",1,2024-05-29 09:00:00
95,"grünen, waschmittel, reintke, potsdamerin, spitzenkandidatin",2,2024-05-29 09:00:00
96,"bmdv, internet, mbit, mindestversorgung, mindestbandbreite",1,2024-05-29 09:00:00
100,"musk, elon, tesla, trump, maven",4,2024-05-29 09:00:00
103,"holz, lignosat, satelliten, weltraum, japan",1,2024-05-29 09:00:00
104,"dax, leitindex, tiefsten, 18, verändert",1,2024-05-29 09:00:00
109,"stipendium, klaar, ananda, zutrauen, kolumnistin",1,2024-05-29 09:00:00
112,"daumen, roboterdaumen, hand, probanden, forscher",1,2024-05-29 09:00:00
113,"rheinmetall, borussia, dortmund, rüstungskonzern, latzel",4,2024-05-29 09:00:00
115,"scholz, hungerstreik, aktivisten, regierungserklärung, hungern",1,2024-05-29 09:00:00
118,"drohnen, amazon, drohne, texas, mahub",2,2024-05-29 09:00:00
119,"alba, chemnitz, niners, thiemann, berliner",1,2024-05-29 09:00:00
121,"promo, potsdam, wahlkreis, möchte, potsdamer",2,2024-05-29 09:00:00
122,"wasserstoff, elektrolyseure, megawatt, airbus, beihilfen",1,2024-05-29 09:00:00
123,"starliner, iss, raumschiff, crew, heliumlecks",1,2024-05-29 09:00:00
126,"heiseshow, podcast, sendung, live, zollfreigrenze",1,2024-05-29 09:00:00
128,"rathaus, nachbarschaftsfest, bezirksnewsletter, schöneberg, schöneberger",1,2024-05-29 09:00:00
134,"eu, ki, rechnungshof, investitionen, investitionsziele",1,2024-05-29 09:00:00
-1,"und, die, in, der, das",141,2024-05-30 07:30:00
0,"ukraine, waffen, russland, nato, russischen",40,2024-05-30 07:30:00
1,"hamas, israel, gazastreifen, israels, geiseln",8,2024-05-30 07:30:00
2,"trump, donald, schuldig, trumps, urteil",38,2024-05-30 07:30:00
3,"dfb, em, hrubesch, fußball, nach",11,2024-05-30 07:30:00
4,"lesung, einsprang, ersatzveranstalter, sprachlosigkeiten, thrall",1,2024-05-30 07:30:00
5,"kg, autos, vw, icct, volkswagen",5,2024-05-30 07:30:00
6,"befristungen, befristeten, gehalt, sachgrundlosen, sachgrundlose",4,2024-05-30 07:30:00
7,"polizei, mann, straße, dönerladen, messer",4,2024-05-30 07:30:00
8,"methylquecksilber, bfr, tierpark, tiere, arten",7,2024-05-30 07:30:00
9,"eu, europawahl, wahl, europa, desinformation",9,2024-05-30 07:30:00
10,"nordart, strizz, reiche, ausstellung, künstler",5,2024-05-30 07:30:00
11,"zverev, alexander, french, paris, slam",7,2024-05-30 07:30:00
12,"bahn, schiene, züge, taxis, lkw",5,2024-05-30 07:30:00
13,"laridschani, raisi, geheimfavorit, iran, atomverhandlungen",1,2024-05-30 07:30:00
14,"foster, micky, maus, musiala, heft",4,2024-05-30 07:30:00
16,"stürzenberger, mannheim, polizisten, pax, islam",7,2024-05-30 07:30:00
17,"afd, stecker, krah, partei, parteien",3,2024-05-30 07:30:00
18,"pv, tüv, gigawatt, anlagen, energien",4,2024-05-30 07:30:00
19,"potsdam, volkspark, potsdamer, straße, rtw",8,2024-05-30 07:30:00
20,"apple, iphone, mac, pro, apples",4,2024-05-30 07:30:00
22,"unfall, auto, polizei, tauentzienstraße, krankenhaus",4,2024-05-30 07:30:00
23,"boateng, jérôme, lask, bayern, fc",4,2024-05-30 07:30:00
24,"macron, europa, frankreich, französischen, nikolas",2,2024-05-30 07:30:00
25,"hochwasser, dwd, dauerregen, landkreis, quadratmeter",5,2024-05-30 07:30:00
26,"sylt, punks, parolen, video, hötger",5,2024-05-30 07:30:00
27,"schulen, lit, lesungen, potsdam, grundschule",3,2024-05-30 07:30:00
28,"nutanix, kubernetes, deno, cloud, grpc",3,2024-05-30 07:30:00
31,"wald, erwärmung, klimawandel, baumarten, modellierung",6,2024-05-30 07:30:00
32,"mcmahon, papua, neuguinea, erdrutsch, leichen",2,2024-05-30 07:30:00
33,"euro, rente, formulare, erklärung, arbeitnehmer",3,2024-05-30 07:30:00
34,"musik, ich, komponist, mich, orchester",7,2024-05-30 07:30:00
35,"windows, update, wsl, microsoft, vorschau",2,2024-05-30 07:30:00
36,"waldgarten, britz, schulz, sträucher, pflanzen",1,2024-05-30 07:30:00
38,"china, zölle, eu, chinesische, autos",2,2024-05-30 07:30:00
39,"eckardt, lebensqualität, nierenspezialist, organtransplantation, therapien",1,2024-05-30 07:30:00
40,"wyler, kp, überflutungen, dwd, jn",3,2024-05-30 07:30:00
41,"halemba, staatsanwaltschaft, nötigung, volksverhetzung, reuß",2,2024-05-30 07:30:00
43,"franco, halemba, ausschuss, akten, untersuchungsausschuss",2,2024-05-30 07:30:00
45,"openai, ki, operationen, generierten, technik",1,2024-05-30 07:30:00
47,"wahlzettel, afd, ungültig, stimmzettel, stimmen",2,2024-05-30 07:30:00
48,"anerkennung, staat, palästina, irland, norwegen",1,2024-05-30 07:30:00
49,"anc, südafrika, absolute, mehrheit, mk",3,2024-05-30 07:30:00
51,"branchen, insolvenzwelle, ibb, 335, investitionsbank",1,2024-05-30 07:30:00
